//记录一个mysql远程连接授权的设置方法，好几次都要重新查。。

mysql -uroot -p
#输入密码

#切换数据库
use `mysql`;

#查询用户和对应的主机信息
select user,host from user;

mysql> select user,host from user; 
+------------------+-----------+
| user             | host      |
+------------------+-----------+
| mysql.infoschema | localhost |
| mysql.session    | localhost |
| mysql.sys        | localhost |
| root             | localhost |
+------------------+-----------+
4 rows in set (0.00 sec)

#执行修改sql，需要修改 root 对应的 host 为 %。
update user set host = '%' where user = 'root';

#刷新
flush privileges;

#再次查询用户和对应的主机信息
select user,host from user;

mysql> select user,host from user;
+------------------+-----------+
| user             | host      |
+------------------+-----------+
| root             | %         |
| mysql.infoschema | localhost |
| mysql.session    | localhost |
| mysql.sys        | localhost |
+------------------+-----------+
4 rows in set (0.00 sec)

#修改完成后还需要授权
grant all privileges on *.* to 'root'@'%';

